{
  "$schema": "https://json-schema.org/draft/2020-12/schema",
  "$id": "https://raw.githubusercontent.com/api-evangelist/amazon-macie/refs/heads/main/json-schema/amazon-macie-get-allow-list-response-schema.json",
  "title": "GetAllowListResponse",
  "description": "GetAllowListResponse schema from Amazon Macie API",
  "type": "object",
  "properties": {
    "arn": {
      "allOf": [
        {
          "$ref": "#/components/schemas/__stringMin71Max89PatternArnAwsAwsCnAwsUsGovMacie2AZ19920D12AllowListAZ0922"
        },
        {
          "description": "The Amazon Resource Name (ARN) of the allow list."
        }
      ]
    },
    "createdAt": {
      "allOf": [
        {
          "$ref": "#/components/schemas/__timestampIso8601"
        },
        {
          "description": "The date and time, in UTC and extended ISO 8601 format, when the allow list was created in Amazon Macie."
        }
      ]
    },
    "criteria": {
      "allOf": [
        {
          "$ref": "#/components/schemas/AllowListCriteria"
        },
        {
          "description": "The criteria that specify the text or text pattern to ignore. The criteria can be the location and name of an S3 object that lists specific text to ignore (s3WordsList), or a regular expression (regex) that defines a text pattern to ignore."
        }
      ]
    },
    "description": {
      "allOf": [
        {
          "$ref": "#/components/schemas/__stringMin1Max512PatternSS"
        },
        {
          "description": "The custom description of the allow list."
        }
      ]
    },
    "id": {
      "allOf": [
        {
          "$ref": "#/components/schemas/__stringMin22Max22PatternAZ0922"
        },
        {
          "description": "The unique identifier for the allow list."
        }
      ]
    },
    "name": {
      "allOf": [
        {
          "$ref": "#/components/schemas/__stringMin1Max128Pattern"
        },
        {
          "description": "The custom name of the allow list."
        }
      ]
    },
    "status": {
      "allOf": [
        {
          "$ref": "#/components/schemas/AllowListStatus"
        },
        {
          "description": "The current status of the allow list, which indicates whether Amazon Macie can access and use the list's criteria."
        }
      ]
    },
    "tags": {
      "allOf": [
        {
          "$ref": "#/components/schemas/TagMap"
        },
        {
          "description": "A map of key-value pairs that specifies which tags (keys and values) are associated with the allow list."
        }
      ]
    },
    "updatedAt": {
      "allOf": [
        {
          "$ref": "#/components/schemas/__timestampIso8601"
        },
        {
          "description": "The date and time, in UTC and extended ISO 8601 format, when the allow list's settings were most recently changed in Amazon Macie."
        }
      ]
    }
  }
}