{
  "arn": "arn:aws:macie2:us-east-1:123456789012:session",
  "createdAt": "example-value",
  "criteria": "example-value",
  "description": "Sensitive data discovery job for PII detection",
  "id": "abc12345-6789-0123",
  "name": "my-custom-identifier",
  "status": "RUNNING",
  "tags": "example-value",
  "updatedAt": "example-value"
}